<?xml version="1.0" encoding="UTF-8"?>
<xs:schema xmlns:xs="http://www.w3.org/2001/XMLSchema">

    <xs:element name="classe">
        <xs:complexType>
            <xs:sequence>
                <xs:element name="alunno" maxOccurs="unbounded">
                    <xs:complexType>
                        <xs:sequence>
                            <xs:element name="nome" type="xs:string"/>
                            <xs:element name="cognome" type="xs:string"/>
                            <xs:element name="data_nascita" type="xs:string"/>
                            <xs:element name="classe" type="xs:string"/>
                            <xs:element name="computer">
                                <xs:complexType>
                                    <xs:sequence>
                                        <xs:element name="data_associazione" type="xs:string"/>
                                        <xs:element name="data_ultimoutilizzo" type="xs:string"/>
                                        <xs:element name="codice_pc" type="xs:string"/>
                                    </xs:sequence>
                                </xs:complexType>
                            </xs:element>
                        </xs:sequence>
                    </xs:complexType>
                </xs:element>
            </xs:sequence>
        </xs:complexType>
    </xs:element>

</xs:schema>
